<?xml version="1.0" encoding="UTF-8"?>
<!DOCTYPE calendar SYSTEM "Resources/calendar.dtd">

<?xml-stylesheet type="text/xsl" href="Resources/calendar_yearview.xsl"?>
<calendar selectedyear="2012" selectedmonth="0" selectedweek="0" selectedday="0">
  <year number="2012">
    <month name="Jan" number="1">
      <week number="1">
        <day name="Mo" number="1">
          <entry id="1" priority="high" color="#FFFF">
            <summary>Hammer Job</summary>
            <starttime hours="9" minutes="44" />
            <endtime hours="9" minutes="44" />
            <duration hours="9" minutes="44" />
            <location>KA</location>
            <description>Teeeest</description>
            <created day="19" month="5" year="2012" hours="9" minutes="44" />
            <modified day="19" month="5" year="2012" hours="9" minutes="44" />
            <comment>Hoffentlich klappts</comment>
            <categories>
              <category>Cate1</category>
              <category>Cate2</category>
              <category>Cate3</category>
            </categories>
          </entry>
        </day>
      </week>
    </month>
    <month name="Feb" number="2">
      <week number="1">
        <day name="Mo" number="1">
          <entry id="1" priority="high" color="#FFFF">
            <summary>Hammer Job</summary>
            <starttime hours="9" minutes="44" />
            <endtime hours="9" minutes="44" />
            <duration hours="9" minutes="44" />
            <location>KA</location>
            <description>Teeeest</description>
            <created day="19" month="5" year="2012" hours="9" minutes="44" />
            <modified day="19" month="5" year="2012" hours="9" minutes="44" />
            <comment>Hoffentlich klappts</comment>
            <categories>
              <category>Cate1</category>
              <category>Cate2</category>
              <category>Cate3</category>
            </categories>
          </entry>
        </day>
      </week>
    </month>
  </year>
</calendar>

